{
  "$schema": "./diagnostic_responses.schema.json",
  "schemaVersion": 1,
  "catalogId": "MERIVA_SMART_DIAGNOSTIC_RESPONSES",
  "language": "pt-BR",
  "confidenceLabels": {
    "LOW": "baixa",
    "MEDIUM": "moderada",
    "HIGH": "alta"
  },
  "defaults": {
    "summary": "O motor de regras encontrou uma hipótese compatível com parte das evidências locais disponíveis.",
    "nextAction": "Recolher mais leituras válidas da ECU antes de concluir.",
    "cautionWithEvidencePrefix": "Base desta hipótese: ",
    "cautionWithEvidenceSuffix": " A pontuação é heurística, não uma probabilidade calibrada; a hipótese não confirma uma peça defeituosa.",
    "cautionWithoutEvidence": "A hipótese não contém evidência rastreável; recolha dados válidos antes de agir."
  },
  "responses": {
    "FALHA_CIRCUITO_AQUECEDOR_O2_B1S1": {
      "title": "Verificar circuito do aquecedor do sensor O2",
      "summary": "O código pode indicar um problema no circuito do aquecedor. Ele não prova, sozinho, que o sensor precise ser substituído."
    },
    "EFICIENCIA_CATALISADOR_BAIXA": {
      "title": "Investigar eficiência do catalisador",
      "summary": "A evidência é compatível com eficiência do catalisador abaixo do esperado. Antes de condenar o catalisador, investigue mistura, falhas de combustão e sinais dos sensores O2 quando disponíveis."
    },
    "FALHA_DE_COMBUSTAO_CILINDRO_1": {
      "title": "Investigar falha de combustão no cilindro 1",
      "summary": "Há evidência compatível com falha de combustão no cilindro indicado. A causa pode estar em ignição, combustível, entrada de ar ou condição mecânica; é necessário testar."
    },
    "SINAL_DE_POSICAO_DA_BORBOLETA_ALTO": {
      "title": "Verificar sinal de posição da borboleta",
      "summary": "O sinal informado pela ECU pode estar acima do esperado. Compare a leitura com a condição de operação e verifique alimentação, aterramento, conector e chicote."
    },
    "RESPOSTA_LENTA_O2_B1S1": {
      "title": "Investigar resposta do sensor O2",
      "summary": "A ECU pode ter detectado resposta lenta do sensor O2. Temperatura, mistura, vazamentos e condições de malha fechada precisam ser consideradas."
    },
    "MISTURA_POBRE": {
      "title": "Investigar possível mistura pobre",
      "summary": "Os ajustes de combustível observados são compatíveis com tendência de mistura pobre no contexto informado. Confirme com leituras repetidas e verifique possíveis causas antes de trocar peças."
    },
    "MISTURA_RICA": {
      "title": "Investigar possível mistura rica",
      "summary": "Os ajustes de combustível observados são compatíveis com tendência de mistura rica no contexto informado. Confirme com leituras repetidas e verifique possíveis causas antes de trocar peças."
    },
    "VACUO_DO_MOTOR_POSSIVELMENTE_ANORMAL": {
      "title": "Verificar pressão do coletor em marcha lenta",
      "summary": "A pressão do coletor observada pode ser alta para a condição declarada. Repita a leitura com motor aquecido e correlacione com RPM, carga e condições mecânicas."
    }
  }
}
